{
  "schemaVersion": 1,
  "documentId": "mass-2026-10-19",
  "date": "2026-10-19",
  "observance": "연중 제29주간 월요일",
  "sourceRefs": [
    "user-hwp-202610"
  ],
  "sections": [
    {
      "id": "entrance-antiphon",
      "kind": "antiphon",
      "title": "입당송",
      "status": "verified",
      "paragraphs": [
        {
          "id": "entrance-antiphon-p1",
          "role": "text",
          "text": "하느님, 당신이 응답해 주시니, 제가 당신께 부르짖나이다.\n귀 기울여 제 말씀 들어 주소서.\n주님, 당신 눈동자처럼 저를 보호하소서. 당신 날개 그늘에 저를 숨겨 주소서.",
          "sourceRef": "user-hwp-202610"
        }
      ]
    },
    {
      "id": "collect",
      "kind": "prayer",
      "title": "본기도",
      "status": "verified",
      "paragraphs": [
        {
          "id": "collect-p1",
          "role": "priest",
          "text": "전능하시고 영원하신 하느님,\n저희가 언제나 성실한 마음으로\n하느님을 정성껏 섬기게 하소서.\n성부와 성령과 함께 천주로서 영원히 살아 계시며 다스리시는 성자\n우리 주 예수 그리스도를 통하여 비나이다.",
          "sourceRef": "user-hwp-202610"
        }
      ]
    },
    {
      "id": "offertory",
      "kind": "prayer",
      "title": "예물 기도",
      "status": "verified",
      "paragraphs": [
        {
          "id": "offertory-p1",
          "role": "priest",
          "text": "주님,\n저희가 자유로운 마음으로 이 예물을 바치오니\n주님의 은총으로 저희를 씻으시어\n저희가 주님께 드리는 이 성찬의 제사로 더욱 깨끗해지게 하소서.\n우리 주 그리스도를 통하여 비나이다.",
          "sourceRef": "user-hwp-202610"
        }
      ]
    },
    {
      "id": "communion-antiphon",
      "kind": "antiphon",
      "title": "영성체송",
      "status": "verified",
      "paragraphs": [
        {
          "id": "communion-antiphon-p1",
          "role": "text",
          "text": "보라, 주님의 눈은 당신을 경외하는 이들에게, 당신 자애를 바라는 이들에게 머무르신다. 주님은 죽음에서 목숨을 건지시고, 굶주릴 때 먹여 살리신다.",
          "sourceRef": "user-hwp-202610"
        }
      ]
    },
    {
      "id": "postcommunion",
      "kind": "prayer",
      "title": "영성체 후 기도",
      "status": "verified",
      "paragraphs": [
        {
          "id": "postcommunion-p1",
          "role": "priest",
          "text": "주님,\n저희가 천상 잔치에 자주 참여하여\n현세에서 도움도 받고 영원한 신비도 배우게 하소서.\n우리 주 그리스도를 통하여 비나이다.",
          "sourceRef": "user-hwp-202610"
        }
      ]
    },
    {
      "id": "reading-1",
      "kind": "reading",
      "title": "제1독서",
      "status": "missing",
      "paragraphs": []
    },
    {
      "id": "psalm",
      "kind": "psalm",
      "title": "화답송",
      "status": "missing",
      "paragraphs": []
    },
    {
      "id": "reading-2",
      "kind": "reading",
      "title": "제2독서",
      "status": "missing",
      "paragraphs": []
    },
    {
      "id": "alleluia",
      "kind": "acclamation",
      "title": "복음 환호송",
      "status": "missing",
      "paragraphs": []
    },
    {
      "id": "gospel",
      "kind": "gospel",
      "title": "복음",
      "status": "missing",
      "paragraphs": []
    },
    {
      "id": "preface",
      "kind": "preface",
      "title": "감사송",
      "status": "missing",
      "paragraphs": []
    },
    {
      "id": "intercessions",
      "kind": "intercession",
      "title": "보편 지향 기도",
      "status": "missing",
      "paragraphs": []
    }
  ]
}
