{
  "schemaVersion": 1,
  "documentId": "mass-2026-10-05",
  "date": "2026-10-05",
  "observance": "연중 제27주간 월요일",
  "sourceRefs": [
    "user-hwp-202610"
  ],
  "sections": [
    {
      "id": "entrance-antiphon",
      "kind": "antiphon",
      "title": "입당송",
      "status": "verified",
      "paragraphs": [
        {
          "id": "entrance-antiphon-p1",
          "role": "text",
          "text": "주님, 모든 것이 당신의 권능 안에 있어, 당신 뜻을 거스를 자 없나이다.\n당신이 하늘과 땅을 지으시고 하늘 아래 모든 것을 만드셨으니,\n당신은 만물의 주님이시옵니다.",
          "sourceRef": "user-hwp-202610"
        }
      ]
    },
    {
      "id": "collect",
      "kind": "prayer",
      "title": "본기도",
      "status": "verified",
      "paragraphs": [
        {
          "id": "collect-p1",
          "role": "priest",
          "text": "전능하시고 영원하신 하느님,\n저희 공로와 소망보다 더 큰 은혜를 베풀어 주시니\n저희 기도를 들으시어\n양심의 가책을 받은 저희 죄를 용서하시고\n감히 청하지 못하는 은혜도 내려 주소서.\n성부와 성령과 함께 천주로서 영원히 살아 계시며 다스리시는 성자\n우리 주 예수 그리스도를 통하여 비나이다.",
          "sourceRef": "user-hwp-202610"
        }
      ]
    },
    {
      "id": "offertory",
      "kind": "prayer",
      "title": "예물 기도",
      "status": "verified",
      "paragraphs": [
        {
          "id": "offertory-p1",
          "role": "priest",
          "text": "주님,\n주님께서 세우신 이 제사를 받아들이시어\n저희가 정성을 다하여 마땅히 거행하는 이 거룩한 신비로\n저희를 거룩하게 하시고 주님의 구원을 이루소서.\n우리 주 그리스도를 통하여 비나이다.",
          "sourceRef": "user-hwp-202610"
        }
      ]
    },
    {
      "id": "communion-antiphon",
      "kind": "antiphon",
      "title": "영성체송",
      "status": "verified",
      "paragraphs": [
        {
          "id": "communion-antiphon-p1",
          "role": "text",
          "text": "당신을 바라는 이에게, 당신을 찾는 영혼에게 주님은 좋으신 분.",
          "sourceRef": "user-hwp-202610"
        }
      ]
    },
    {
      "id": "postcommunion",
      "kind": "prayer",
      "title": "영성체 후 기도",
      "status": "verified",
      "paragraphs": [
        {
          "id": "postcommunion-p1",
          "role": "priest",
          "text": "전능하신 하느님,\n성체를 받아 모신 저희가 이 성사의 힘으로 자라나\n마침내 그리스도와 하나 되게 하소서.\n우리 주 그리스도를 통하여 비나이다.",
          "sourceRef": "user-hwp-202610"
        }
      ]
    },
    {
      "id": "reading-1",
      "kind": "reading",
      "title": "제1독서",
      "status": "missing",
      "paragraphs": []
    },
    {
      "id": "psalm",
      "kind": "psalm",
      "title": "화답송",
      "status": "missing",
      "paragraphs": []
    },
    {
      "id": "reading-2",
      "kind": "reading",
      "title": "제2독서",
      "status": "missing",
      "paragraphs": []
    },
    {
      "id": "alleluia",
      "kind": "acclamation",
      "title": "복음 환호송",
      "status": "missing",
      "paragraphs": []
    },
    {
      "id": "gospel",
      "kind": "gospel",
      "title": "복음",
      "status": "missing",
      "paragraphs": []
    },
    {
      "id": "preface",
      "kind": "preface",
      "title": "감사송",
      "status": "missing",
      "paragraphs": []
    },
    {
      "id": "intercessions",
      "kind": "intercession",
      "title": "보편 지향 기도",
      "status": "missing",
      "paragraphs": []
    }
  ]
}
