{
  "schemaVersion": 1,
  "documentId": "mass-2026-10-30",
  "date": "2026-10-30",
  "observance": "연중 제30주간 금요일",
  "sourceRefs": [
    "user-hwp-202610"
  ],
  "sections": [
    {
      "id": "entrance-antiphon",
      "kind": "antiphon",
      "title": "입당송",
      "status": "verified",
      "paragraphs": [
        {
          "id": "entrance-antiphon-p1",
          "role": "text",
          "text": "주님을 찾는 마음은 기뻐하여라.\n주님과 그 권능을 구하여라. 언제나 그 얼굴을 찾아라.",
          "sourceRef": "user-hwp-202610"
        }
      ]
    },
    {
      "id": "collect",
      "kind": "prayer",
      "title": "본기도",
      "status": "verified",
      "paragraphs": [
        {
          "id": "collect-p1",
          "role": "priest",
          "text": "전능하시고 영원하신 하느님,\n저희 안에 믿음과 희망과 사랑이 자라나게 하시고\n저희가 하느님의 계명을 지켜 영원한 생명을 얻게 하소서.\n성부와 성령과 함께 천주로서 영원히 살아 계시며 다스리시는 성자\n우리 주 예수 그리스도를 통하여 비나이다.",
          "sourceRef": "user-hwp-202610"
        }
      ]
    },
    {
      "id": "offertory",
      "kind": "prayer",
      "title": "예물 기도",
      "status": "verified",
      "paragraphs": [
        {
          "id": "offertory-p1",
          "role": "priest",
          "text": "주님,\n주님께 올리는 이 예물을 굽어보시고\n저희가 바치는 제사가 주님께 영광이 되게 하소서.\n우리 주 그리스도를 통하여 비나이다.",
          "sourceRef": "user-hwp-202610"
        }
      ]
    },
    {
      "id": "communion-antiphon",
      "kind": "antiphon",
      "title": "영성체송",
      "status": "verified",
      "paragraphs": [
        {
          "id": "communion-antiphon-p1",
          "role": "text",
          "text": "당신의 구원에 우리가 환호하며, 하느님 이름으로 깃발을 높이리이다.",
          "sourceRef": "user-hwp-202610"
        }
      ]
    },
    {
      "id": "postcommunion",
      "kind": "prayer",
      "title": "영성체 후 기도",
      "status": "verified",
      "paragraphs": [
        {
          "id": "postcommunion-p1",
          "role": "priest",
          "text": "주님,\n성체성사의 은혜를 풍부히 내려 주시어\n저희가 거행하는 이 신비를 그대로 실천하게 하소서.\n우리 주 그리스도를 통하여 비나이다.",
          "sourceRef": "user-hwp-202610"
        }
      ]
    },
    {
      "id": "reading-1",
      "kind": "reading",
      "title": "제1독서",
      "status": "missing",
      "paragraphs": []
    },
    {
      "id": "psalm",
      "kind": "psalm",
      "title": "화답송",
      "status": "missing",
      "paragraphs": []
    },
    {
      "id": "reading-2",
      "kind": "reading",
      "title": "제2독서",
      "status": "missing",
      "paragraphs": []
    },
    {
      "id": "alleluia",
      "kind": "acclamation",
      "title": "복음 환호송",
      "status": "missing",
      "paragraphs": []
    },
    {
      "id": "gospel",
      "kind": "gospel",
      "title": "복음",
      "status": "missing",
      "paragraphs": []
    },
    {
      "id": "preface",
      "kind": "preface",
      "title": "감사송",
      "status": "missing",
      "paragraphs": []
    },
    {
      "id": "intercessions",
      "kind": "intercession",
      "title": "보편 지향 기도",
      "status": "missing",
      "paragraphs": []
    }
  ]
}
