{
  "schemaVersion": 1,
  "documentId": "mass-2026-10-01",
  "date": "2026-10-01",
  "observance": "아기 예수의 성녀 데레사 동정 학자 기념일",
  "sourceRefs": [
    "user-hwp-202610"
  ],
  "sections": [
    {
      "id": "entrance-antiphon",
      "kind": "antiphon",
      "title": "입당송",
      "status": "verified",
      "paragraphs": [
        {
          "id": "entrance-antiphon-p1",
          "role": "text",
          "text": "주님은 그를 감싸안아 돌보아 주시고, 당신 눈동자처럼 지켜 주셨네. 독수리가 날개를 펴서 새끼를 들어 올려 죽지 위에 얹어 나르듯, 주님 홀로 그를 인도하셨네.",
          "sourceRef": "user-hwp-202610"
        }
      ]
    },
    {
      "id": "collect",
      "kind": "prayer",
      "title": "본기도",
      "status": "verified",
      "paragraphs": [
        {
          "id": "collect-p1",
          "role": "priest",
          "text": "하느님,\n비천한 이들과 어린아이들을 하느님의 나라로 이끌어 주시니\n저희가 복된 데레사의 길을 충실히 따라\n그의 전구로 하느님의 영원한 영광을 뵈옵게 하소서.\n성부와 성령과 함께 천주로서 영원히 살아 계시며 다스리시는 성자\n우리 주 예수 그리스도를 통하여 비나이다.",
          "sourceRef": "user-hwp-202610"
        }
      ]
    },
    {
      "id": "offertory",
      "kind": "prayer",
      "title": "예물 기도",
      "status": "verified",
      "paragraphs": [
        {
          "id": "offertory-p1",
          "role": "priest",
          "text": "주님,\n복된 데레사를 기리는 저희가 놀라우신 주님을 찬양하며\n지극히 높으신 주님 앞에 엎드려 청하오니\n그의 공로를 기꺼워하셨듯이\n저희가 바치는 제사도 기쁘게 받아 주소서.\n우리 주 그리스도를 통하여 비나이다.",
          "sourceRef": "user-hwp-202610"
        }
      ]
    },
    {
      "id": "communion-antiphon",
      "kind": "antiphon",
      "title": "영성체송",
      "status": "verified",
      "paragraphs": [
        {
          "id": "communion-antiphon-p1",
          "role": "text",
          "text": "주님이 말씀하신다. 너희가 회개하여 어린이처럼 되지 않으면, 결코 하늘 나라에 들어가지 못하리라.",
          "sourceRef": "user-hwp-202610"
        }
      ]
    },
    {
      "id": "postcommunion",
      "kind": "prayer",
      "title": "영성체 후 기도",
      "status": "verified",
      "paragraphs": [
        {
          "id": "postcommunion-p1",
          "role": "priest",
          "text": "주님,\n저희가 받아 모신 성체의 힘으로\n복된 데레사가 주님께 바친 그 사랑이 저희 안에서도 타오르게 하시어\n저희가 모든 사람의 구원을 위하여 자신을 바치게 하소서.\n우리 주 그리스도를 통하여 비나이다.",
          "sourceRef": "user-hwp-202610"
        }
      ]
    },
    {
      "id": "reading-1",
      "kind": "reading",
      "title": "제1독서",
      "status": "missing",
      "paragraphs": []
    },
    {
      "id": "psalm",
      "kind": "psalm",
      "title": "화답송",
      "status": "missing",
      "paragraphs": []
    },
    {
      "id": "reading-2",
      "kind": "reading",
      "title": "제2독서",
      "status": "missing",
      "paragraphs": []
    },
    {
      "id": "alleluia",
      "kind": "acclamation",
      "title": "복음 환호송",
      "status": "missing",
      "paragraphs": []
    },
    {
      "id": "gospel",
      "kind": "gospel",
      "title": "복음",
      "status": "missing",
      "paragraphs": []
    },
    {
      "id": "preface",
      "kind": "preface",
      "title": "감사송",
      "status": "missing",
      "paragraphs": []
    },
    {
      "id": "intercessions",
      "kind": "intercession",
      "title": "보편 지향 기도",
      "status": "missing",
      "paragraphs": []
    }
  ]
}
